{
  "schema_version": "0.1.0",
  "feature_id": "tpf_proj_mission_fit_001_preferences_work_mode",
  "projection_id": "proj_mission_fit_001",
  "decision_log_id": "pdl_projection_001",
  "twin_id": "hdt_example_001",
  "subject_id": "sub_example_001",
  "mission_id": "mission_agentic_data_platform_001",
  "recipient_id": "client_example_001",
  "policy_id": "cp_example_001",
  "feature_family": "preference",
  "feature_name": "preferences.work_modes",
  "feature_value": "remote_first",
  "feature_confidence": "medium",
  "source_field_path": "preferences.work_modes",
  "source_field_decision": "allow",
  "source_field_reason": "field_minimized",
  "denial_reason_visibility": "safe_reason_only",
  "domain_context": {
    "domain_id": "holographme.mission_projection",
    "source_modality": "structured_human_digital_twin_projection",
    "calibration_state": "in_domain"
  },
  "consent_scope_snapshot": {
    "schema_version": "0.1.0",
    "policy_id": "cp_example_001",
    "subject_id": "sub_example_001",
    "recipient_id": "client_example_001",
    "purpose": "mission_fit",
    "allowed_recipients": ["client_example_001"],
    "allowed_purposes": ["mission_fit"],
    "allowed_fields_digest": "sha256:b5a2c96250612366ea272ffac6d9744aaf4b45cdb4b11d0d63af2ea24a917cbd",
    "forbidden_fields_digest": "sha256:d6bc95e2274abff8aa38c1907993e76ab70792d6f34fbe36ca6b5b27dd195d21",
    "expires_at": "2026-06-01T00:00:00Z",
    "retention_rule": "mission_scope_only",
    "revocation": {"revocable": true, "method": "subject_request", "contact": "subject_portal"},
    "delegation": {"agents_allowed": true, "max_authority_band": "recommend"},
    "audit": {"log_access": true, "emit_receipts": true, "notify_subject": true}
  },
  "mission_governance_snapshot": {
    "mission_id": "mission_agentic_data_platform_001",
    "authority_band": "recommend",
    "audit_required": true,
    "human_approval_required": true,
    "conformance_tags": ["mission_fit"]
  },
  "transition_receipt_ref": {
    "receipt_id": "tr_projection_001",
    "twin_id": "hdt_example_001",
    "action": "mission_fit_projection",
    "actor_id": "holographme_projection_runtime",
    "actor_type": "system",
    "timestamp": "2026-05-04T18:30:00Z",
    "policy_version": "0.1.0",
    "previous_state_hash": "sha256:cfe41b1bb5c9139d6b3e26dd9b9aef23cfbbd146324c6ef3cfa10ae44c967421",
    "new_state_hash": "sha256:11507a0e2f5e69d5f780c2d3a563611b48fb41d32ebb0ce20b9aa82ad1ec7d8c",
    "approval_band": "recommend",
    "rollback_supported": true,
    "rollback_method": "expire_projection_and_revoke_access",
    "replay_hints": {"runtime_version": "holographme-projection-runtime-0.1.0"}
  },
  "projection_decision_log_ref": {
    "schema_version": "0.1.0",
    "decision_log_id": "pdl_projection_001",
    "projection_id": "proj_mission_fit_001",
    "twin_id": "hdt_example_001",
    "subject_id": "sub_example_001",
    "mission_id": "mission_agentic_data_platform_001",
    "recipient_id": "client_example_001",
    "policy_id": "cp_example_001",
    "purpose": "mission_fit",
    "generated_at": "2026-05-04T18:30:00Z"
  },
  "retention_rule": "mission_scope_only",
  "revocation_state": "active",
  "effective_authority_band": "recommend",
  "policy_state": "allowed",
  "do_not_learn": true,
  "do_not_link": true,
  "raw_twin_payload_present": false,
  "hash_algorithm": "sha256",
  "hash_canonicalization": "canonical_json_v0.1_utf8_nfc_sorted_keys_no_insignificant_ws",
  "content_hash": "sha256:6ce6d1da895e01a578136ea68479c3c5e49aaa62c9075e55f88f77205acef3a9",
  "lineage_hash": "sha256:27230052d7f1f34714d4c06f4d1ff2dff4544a23dd93331f9c001539cd4f44b4",
  "created_at": "2026-05-04T18:31:00Z"
}
